18:33:50.415219 IP 192.168.8.122.49334 > qh-in-f127.1e100.net.19305: UDP, length 116
18:33:50.443594 IP 173.194.68.189.https > 192.168.8.122.46805: UDP, length 419
18:33:50.450100 IP qh-in-f127.1e100.net.19305 > 192.168.8.122.49334: UDP, length 104
18:33:50.469373 IP 192.168.8.122.46805 > 173.194.68.189.https: UDP, length 38
18:33:50.470408 IP 209.85.201.189.https > 192.168.8.122.52521: UDP, length 421
18:33:50.496580 IP 192.168.8.122.52521 > 209.85.201.189.https: UDP, length 41
18:33:50.871154 IP 192.168.8.122.40690 > ec2-54-236-117-189.compute-1.amazonaws.com.https: Flags [S], seq 1840249420, win 29200, options [mss 1460,sackOK,TS val 8045252 ecr 0,nop,wscale 7], length 0
18:33:50.871388 IP 192.168.8.122.40692 > ec2-54-236-117-189.compute-1.amazonaws.com.https: Flags [S], seq 3904488530, win 29200, options [mss 1460,sackOK,TS val 8045252 ecr 0,nop,wscale 7], length 0
18:33:50.892423 IP ec2-54-236-117-189.compute-1.amazonaws.com.https > 192.168.8.122.40690: Flags [S.], seq 81109139, ack 1840249421, win 17898, options [mss 8961,sackOK,TS val 262591509 ecr 8045252,nop,wscale 8], length 0
18:33:50.892460 IP 192.168.8.122.40690 > ec2-54-236-117-189.compute-1.amazonaws.com.https: Flags [.], ack 1, win 229, options [nop,nop,TS val 8045257 ecr 262591509], length 0
18:33:50.892647 IP 192.168.8.122.40690 > ec2-54-236-117-189.compute-1.amazonaws.com.https: Flags [P.], seq 1:518, ack 1, win 229, options [nop,nop,TS val 8045257 ecr 262591509], length 517
18:33:50.895570 IP ec2-54-236-117-189.compute-1.amazonaws.com.https > 192.168.8.122.40692: Flags [S.], seq 710340626, ack 3904488531, win 17898, options [mss 8961,sackOK,TS val 262591510 ecr 8045252,nop,wscale 8], length 0
18:33:50.895592 IP 192.168.8.122.40692 > ec2-54-236-117-189.compute-1.amazonaws.com.https: Flags [.], ack 1, win 229, options [nop,nop,TS val 8045258 ecr 262591510], length 0
18:33:50.895725 IP 192.168.8.122.40692 > ec2-54-236-117-189.compute-1.amazonaws.com.https: Flags [P.], seq 1:518, ack 1, win 229, options [nop,nop,TS val 8045258 ecr 262591510], length 517
18:33:50.915527 IP 192.168.8.122.49334 > qh-in-f127.1e100.net.19305: UDP, length 116
18:33:50.918621 IP ec2-54-236-117-189.compute-1.amazonaws.com.https > 192.168.8.122.40690: Flags [.], ack 518, win 75, options [nop,nop,TS val 262591515 ecr 8045257], length 0
18:33:50.918631 IP ec2-54-236-117-189.compute-1.amazonaws.com.https > 192.168.8.122.40690: Flags [P.], seq 1:138, ack 518, win 75, options [nop,nop,TS val 262591515 ecr 8045257], length 137
18:33:50.918637 IP 192.168.8.122.40690 > ec2-54-236-117-189.compute-1.amazonaws.com.https: Flags [.], ack 138, win 237, options [nop,nop,TS val 8045264 ecr 262591515], length 0
18:33:50.918742 IP 192.168.8.122.40690 > ec2-54-236-117-189.compute-1.amazonaws.com.https: Flags [P.], seq 518:569, ack 138, win 237, options [nop,nop,TS val 8045264 ecr 262591515], length 51
18:33:50.919140 IP 192.168.8.122.40690 > ec2-54-236-117-189.compute-1.amazonaws.com.https: Flags [P.], seq 569:1067, ack 138, win 237, options [nop,nop,TS val 8045264 ecr 262591515], length 498
18:33:50.919304 IP ec2-54-236-117-189.compute-1.amazonaws.com.https > 192.168.8.122.40692: Flags [.], ack 518, win 75, options [nop,nop,TS val 262591515 ecr 8045258], length 0
18:33:50.919311 IP ec2-54-236-117-189.compute-1.amazonaws.com.https > 192.168.8.122.40692: Flags [P.], seq 1:138, ack 518, win 75, options [nop,nop,TS val 262591515 ecr 8045258], length 137
18:33:50.919315 IP 192.168.8.122.40692 > ec2-54-236-117-189.compute-1.amazonaws.com.https: Flags [.], ack 138, win 237, options [nop,nop,TS val 8045264 ecr 262591515], length 0
18:33:50.919404 IP 192.168.8.122.40692 > ec2-54-236-117-189.compute-1.amazonaws.com.https: Flags [P.], seq 518:569, ack 138, win 237, options [nop,nop,TS val 8045264 ecr 262591515], length 51
18:33:50.919693 IP 192.168.8.122.40692 > ec2-54-236-117-189.compute-1.amazonaws.com.https: Flags [P.], seq 569:1067, ack 138, win 237, options [nop,nop,TS val 8045264 ecr 262591515], length 498
18:33:50.940048 IP ec2-54-236-117-189.compute-1.amazonaws.com.https > 192.168.8.122.40690: Flags [.], ack 518, win 75, options [nop,nop,TS val 262591521 ecr 8045264,nop,nop,sack 1 {569:1067}], length 0
18:33:50.940063 IP ec2-54-236-117-189.compute-1.amazonaws.com.https > 192.168.8.122.40690: Flags [.], ack 1067, win 75, options [nop,nop,TS val 262591521 ecr 8045264], length 0
18:33:50.940070 IP ec2-54-236-117-189.compute-1.amazonaws.com.https > 192.168.8.122.40692: Flags [.], ack 1067, win 79, options [nop,nop,TS val 262591521 ecr 8045264], length 0
18:33:50.940809 IP ec2-54-236-117-189.compute-1.amazonaws.com.https > 192.168.8.122.40690: Flags [P.], seq 138:169, ack 1067, win 75, options [nop,nop,TS val 262591521 ecr 8045264], length 31
18:33:50.940822 IP ec2-54-236-117-189.compute-1.amazonaws.com.https > 192.168.8.122.40692: Flags [P.], seq 138:169, ack 1067, win 79, options [nop,nop,TS val 262591521 ecr 8045264], length 31
18:33:50.940826 IP ec2-54-236-117-189.compute-1.amazonaws.com.https > 192.168.8.122.40690: Flags [F.], seq 169, ack 1067, win 75, options [nop,nop,TS val 262591521 ecr 8045264], length 0
18:33:50.941045 IP 192.168.8.122.40690 > ec2-54-236-117-189.compute-1.amazonaws.com.https: Flags [F.], seq 1067, ack 170, win 237, options [nop,nop,TS val 8045269 ecr 262591521], length 0
18:33:50.941253 IP 192.168.8.122.40692 > ec2-54-236-117-189.compute-1.amazonaws.com.https: Flags [F.], seq 1067, ack 169, win 237, options [nop,nop,TS val 8045269 ecr 262591521], length 0
18:33:50.942407 IP ec2-54-236-117-189.compute-1.amazonaws.com.https > 192.168.8.122.40692: Flags [F.], seq 169, ack 1067, win 79, options [nop,nop,TS val 262591521 ecr 8045264], length 0
18:33:50.942419 IP 192.168.8.122.40692 > ec2-54-236-117-189.compute-1.amazonaws.com.https: Flags [.], ack 170, win 237, options [nop,nop,TS val 8045269 ecr 262591521], length 0
18:33:50.951302 IP qh-in-f127.1e100.net.19305 > 192.168.8.122.49334: UDP, length 104
18:33:50.962129 IP ec2-54-236-117-189.compute-1.amazonaws.com.https > 192.168.8.122.40690: Flags [.], ack 1068, win 75, options [nop,nop,TS val 262591526 ecr 8045269], length 0
18:33:50.966189 IP ec2-54-236-117-189.compute-1.amazonaws.com.https > 192.168.8.122.40692: Flags [.], ack 1068, win 79, options [nop,nop,TS val 262591527 ecr 8045269], length 0
18:33:51.235210 STP 802.1d, Config, Flags [none], bridge-id 801e.28:57:67:b1:fa:47.0c01, length 43
18:33:51.383148 IP 192.168.8.122.31880 > vdnssec1.srv.prnynj.cv.net.domain: 23338+ PTR? 127.22.125.74.in-addr.arpa. (44)
18:33:51.383157 IP 192.168.8.122.31880 > vdnssec2.srv.prnynj.cv.net.domain: 23338+ PTR? 127.22.125.74.in-addr.arpa. (44)
18:33:51.413593 IP vdnssec1.srv.prnynj.cv.net.domain > 192.168.8.122.31880: 23338 1/0/0 PTR qh-in-f127.1e100.net. (78)
18:33:51.413836 IP 192.168.8.122.53236 > vdnssec1.srv.prnynj.cv.net.domain: 32479+ PTR? 122.8.168.192.in-addr.arpa. (44)
18:33:51.415827 IP 192.168.8.122.49334 > qh-in-f127.1e100.net.19305: UDP, length 116
18:33:51.418883 IP vdnssec2.srv.prnynj.cv.net.domain > 192.168.8.122.31880: 23338 1/0/0 PTR qh-in-f127.1e100.net. (78)
18:33:51.418905 IP 192.168.8.122 > vdnssec2.srv.prnynj.cv.net: ICMP 192.168.8.122 udp port 31880 unreachable, length 114
18:33:51.433750 IP vdnssec1.srv.prnynj.cv.net.domain > 192.168.8.122.53236: 32479 NXDomain 0/0/0 (44)
18:33:51.434061 IP 192.168.8.122.60384 > vdnssec1.srv.prnynj.cv.net.domain: 3750+ PTR? 189.68.194.173.in-addr.arpa. (45)
18:33:51.453507 IP qh-in-f127.1e100.net.19305 > 192.168.8.122.49334: UDP, length 104
18:33:51.464392 IP vdnssec1.srv.prnynj.cv.net.domain > 192.168.8.122.60384: 3750 NXDomain 0/1/0 (105)
18:33:51.464569 IP 192.168.8.122.54476 > vdnssec1.srv.prnynj.cv.net.domain: 26048+ PTR? 189.201.85.209.in-addr.arpa. (45)
18:33:51.495322 IP vdnssec1.srv.prnynj.cv.net.domain > 192.168.8.122.54476: 26048 NXDomain 0/1/0 (105)
18:33:51.495596 IP 192.168.8.122.36139 > vdnssec1.srv.prnynj.cv.net.domain: 41920+ PTR? 189.117.236.54.in-addr.arpa. (45)
18:33:51.514552 IP vdnssec1.srv.prnynj.cv.net.domain > 192.168.8.122.36139: 41920 1/0/0 PTR ec2-54-236-117-189.compute-1.amazonaws.com. (101)
18:33:51.877467 IP 192.168.8.122.40694 > ec2-54-236-117-189.compute-1.amazonaws.com.https: Flags [S], seq 3094534126, win 29200, options [mss 1460,sackOK,TS val 8045503 ecr 0,nop,wscale 7], length 0
18:33:51.877658 IP 192.168.8.122.40696 > ec2-54-236-117-189.compute-1.amazonaws.com.https: Flags [S], seq 2167361760, win 29200, options [mss 1460,sackOK,TS val 8045503 ecr 0,nop,wscale 7], length 0
18:33:51.899233 IP ec2-54-236-117-189.compute-1.amazonaws.com.https > 192.168.8.122.40694: Flags [S.], seq 1771649621, ack 3094534127, win 17898, options [mss 8961,sackOK,TS val 262591760 ecr 8045503,nop,wscale 8], length 0
18:33:51.899269 IP 192.168.8.122.40694 > ec2-54-236-117-189.compute-1.amazonaws.com.https: Flags [.], ack 1, win 229, options [nop,nop,TS val 8045509 ecr 262591760], length 0
18:33:51.899418 IP 192.168.8.122.40694 > ec2-54-236-117-189.compute-1.amazonaws.com.https: Flags [P.], seq 1:518, ack 1, win 229, options [nop,nop,TS val 8045509 ecr 262591760], length 517
18:33:51.902106 IP ec2-54-236-117-189.compute-1.amazonaws.com.https > 192.168.8.122.40696: Flags [S.], seq 1262550401, ack 2167361761, win 17898, options [mss 8961,sackOK,TS val 262591761 ecr 8045503,nop,wscale 8], length 0
18:33:51.902127 IP 192.168.8.122.40696 > ec2-54-236-117-189.compute-1.amazonaws.com.https: Flags [.], ack 1, win 229, options [nop,nop,TS val 8045509 ecr 262591761], length 0
18:33:51.902236 IP 192.168.8.122.40696 > ec2-54-236-117-189.compute-1.amazonaws.com.https: Flags [P.], seq 1:518, ack 1, win 229, options [nop,nop,TS val 8045509 ecr 262591761], length 517
18:33:51.916106 IP 192.168.8.122.49334 > qh-in-f127.1e100.net.19305: UDP, length 116
18:33:51.923560 IP ec2-54-236-117-189.compute-1.amazonaws.com.https > 192.168.8.122.40694: Flags [.], ack 518, win 75, options [nop,nop,TS val 262591766 ecr 8045509], length 0
18:33:51.924379 IP ec2-54-236-117-189.compute-1.amazonaws.com.https > 192.168.8.122.40694: Flags [P.], seq 1:138, ack 518, win 75, options [nop,nop,TS val 262591766 ecr 8045509], length 137
18:33:51.924390 IP 192.168.8.122.40694 > ec2-54-236-117-189.compute-1.amazonaws.com.https: Flags [.], ack 138, win 237, options [nop,nop,TS val 8045515 ecr 262591766], length 0
18:33:51.924512 IP 192.168.8.122.40694 > ec2-54-236-117-189.compute-1.amazonaws.com.https: Flags [P.], seq 518:569, ack 138, win 237, options [nop,nop,TS val 8045515 ecr 262591766], length 51
18:33:51.924951 IP 192.168.8.122.40694 > ec2-54-236-117-189.compute-1.amazonaws.com.https: Flags [P.], seq 569:1067, ack 138, win 237, options [nop,nop,TS val 8045515 ecr 262591766], length 498
18:33:51.927248 IP ec2-54-236-117-189.compute-1.amazonaws.com.https > 192.168.8.122.40696: Flags [.], ack 518, win 75, options [nop,nop,TS val 262591767 ecr 8045509], length 0
18:33:51.927258 IP ec2-54-236-117-189.compute-1.amazonaws.com.https > 192.168.8.122.40696: Flags [P.], seq 1:138, ack 518, win 75, options [nop,nop,TS val 262591767 ecr 8045509], length 137
18:33:51.927265 IP 192.168.8.122.40696 > ec2-54-236-117-189.compute-1.amazonaws.com.https: Flags [.], ack 138, win 237, options [nop,nop,TS val 8045516 ecr 262591767], length 0
18:33:51.927367 IP 192.168.8.122.40696 > ec2-54-236-117-189.compute-1.amazonaws.com.https: Flags [P.], seq 518:569, ack 138, win 237, options [nop,nop,TS val 8045516 ecr 262591767], length 51
18:33:51.927671 IP 192.168.8.122.40696 > ec2-54-236-117-189.compute-1.amazonaws.com.https: Flags [P.], seq 569:1067, ack 138, win 237, options [nop,nop,TS val 8045516 ecr 262591767], length 498
18:33:51.944191 IP qh-in-f127.1e100.net.19305 > 192.168.8.122.49334: UDP, length 104
18:33:51.944205 IP ec2-54-236-117-189.compute-1.amazonaws.com.https > 192.168.8.122.40694: Flags [P.], seq 138:169, ack 569, win 75, options [nop,nop,TS val 262591772 ecr 8045515], length 31
18:33:51.944460 IP 192.168.8.122.40694 > ec2-54-236-117-189.compute-1.amazonaws.com.https: Flags [F.], seq 1067, ack 169, win 237, options [nop,nop,TS val 8045520 ecr 262591772], length 0
18:33:51.945915 IP ec2-54-236-117-189.compute-1.amazonaws.com.https > 192.168.8.122.40694: Flags [F.], seq 169, ack 569, win 75, options [nop,nop,TS val 262591772 ecr 8045515], length 0
18:33:51.945928 IP 192.168.8.122.40694 > ec2-54-236-117-189.compute-1.amazonaws.com.https: Flags [.], ack 170, win 237, options [nop,nop,TS val 8045520 ecr 262591772], length 0
18:33:51.949149 IP ec2-54-236-117-189.compute-1.amazonaws.com.https > 192.168.8.122.40696: Flags [.], ack 1067, win 79, options [nop,nop,TS val 262591773 ecr 8045516], length 0
18:33:51.949160 IP ec2-54-236-117-189.compute-1.amazonaws.com.https > 192.168.8.122.40696: Flags [P.], seq 138:169, ack 1067, win 79, options [nop,nop,TS val 262591773 ecr 8045516], length 31
18:33:51.949169 IP ec2-54-236-117-189.compute-1.amazonaws.com.https > 192.168.8.122.40696: Flags [F.], seq 169, ack 1067, win 79, options [nop,nop,TS val 262591773 ecr 8045516], length 0
18:33:51.949338 IP 192.168.8.122.40696 > ec2-54-236-117-189.compute-1.amazonaws.com.https: Flags [F.], seq 1067, ack 170, win 237, options [nop,nop,TS val 8045521 ecr 262591773], length 0
18:33:51.965196 IP ec2-54-236-117-189.compute-1.amazonaws.com.https > 192.168.8.122.40694: Flags [.], ack 1068, win 79, options [nop,nop,TS val 262591777 ecr 8045515], length 0
18:33:51.974107 IP ec2-54-236-117-189.compute-1.amazonaws.com.https > 192.168.8.122.40696: Flags [.], ack 1068, win 79, options [nop,nop,TS val 262591779 ecr 8045521], length 0
18:33:52.134609 IP 192.168.8.122.52620 > 167.206.252.114.https: Flags [.], ack 457261458, win 452, options [nop,nop,TS val 8045568 ecr 3340353319], length 0
18:33:52.148010 IP 167.206.252.114.https > 192.168.8.122.52620: Flags [.], ack 1, win 252, options [nop,nop,TS val 3340398362 ecr 8023011], length 0
18:33:52.382827 IP 192.168.8.122.56024 > vdnssec1.srv.prnynj.cv.net.domain: 53969+ PTR? 135.245.206.167.in-addr.arpa. (46)
18:33:52.398370 IP vdnssec1.srv.prnynj.cv.net.domain > 192.168.8.122.56024: 53969 1/0/0 PTR vdnssec1.srv.prnynj.cv.net. (86)
18:33:52.398621 IP 192.168.8.122.16063 > vdnssec1.srv.prnynj.cv.net.domain: 14702+ PTR? 136.245.206.167.in-addr.arpa. (46)
18:33:52.413060 IP vdnssec1.srv.prnynj.cv.net.domain > 192.168.8.122.16063: 14702 1/0/0 PTR vdnssec2.srv.prnynj.cv.net. (86)
18:33:52.413654 IP 192.168.8.122.25002 > vdnssec1.srv.prnynj.cv.net.domain: 13516+ PTR? 114.252.206.167.in-addr.arpa. (46)
18:33:52.416340 IP 192.168.8.122.49334 > qh-in-f127.1e100.net.19305: UDP, length 116
18:33:52.427639 IP vdnssec1.srv.prnynj.cv.net.domain > 192.168.8.122.25002: 13516 NXDomain 0/1/0 (97)
18:33:52.445320 IP qh-in-f127.1e100.net.19305 > 192.168.8.122.49334: UDP, length 104
18:33:52.881308 IP 192.168.8.122.40698 > ec2-54-236-117-189.compute-1.amazonaws.com.https: Flags [S], seq 676391, win 29200, options [mss 1460,sackOK,TS val 8045754 ecr 0,nop,wscale 7], length 0
18:33:52.881478 IP 192.168.8.122.40700 > ec2-54-236-117-189.compute-1.amazonaws.com.https: Flags [S], seq 893374231, win 29200, options [mss 1460,sackOK,TS val 8045754 ecr 0,nop,wscale 7], length 0
18:33:52.904618 IP ec2-54-236-117-189.compute-1.amazonaws.com.https > 192.168.8.122.40698: Flags [S.], seq 450011666, ack 676392, win 17898, options [mss 8961,sackOK,TS val 262592012 ecr 8045754,nop,wscale 8], length 0
18:33:52.904659 IP 192.168.8.122.40698 > ec2-54-236-117-189.compute-1.amazonaws.com.https: Flags [.], ack 1, win 229, options [nop,nop,TS val 8045760 ecr 262592012], length 0
18:33:52.904835 IP 192.168.8.122.40698 > ec2-54-236-117-189.compute-1.amazonaws.com.https: Flags [P.], seq 1:518, ack 1, win 229, options [nop,nop,TS val 8045760 ecr 262592012], length 517
18:33:52.908861 IP ec2-54-236-117-189.compute-1.amazonaws.com.https > 192.168.8.122.40700: Flags [S.], seq 2663100616, ack 893374232, win 17898, options [mss 8961,sackOK,TS val 262592013 ecr 8045754,nop,wscale 8], length 0
18:33:52.908882 IP 192.168.8.122.40700 > ec2-54-236-117-189.compute-1.amazonaws.com.https: Flags [.], ack 1, win 229, options [nop,nop,TS val 8045761 ecr 262592013], length 0
18:33:52.909016 IP 192.168.8.122.40700 > ec2-54-236-117-189.compute-1.amazonaws.com.https: Flags [P.], seq 1:518, ack 1, win 229, options [nop,nop,TS val 8045761 ecr 262592013], length 517
18:33:52.916653 IP 192.168.8.122.49334 > qh-in-f127.1e100.net.19305: UDP, length 116
18:33:52.931663 IP ec2-54-236-117-189.compute-1.amazonaws.com.https > 192.168.8.122.40698: Flags [.], ack 518, win 75, options [nop,nop,TS val 262592018 ecr 8045760], length 0
18:33:52.931677 IP ec2-54-236-117-189.compute-1.amazonaws.com.https > 192.168.8.122.40698: Flags [P.], seq 1:138, ack 518, win 75, options [nop,nop,TS val 262592018 ecr 8045760], length 137
18:33:52.931685 IP 192.168.8.122.40698 > ec2-54-236-117-189.compute-1.amazonaws.com.https: Flags [.], ack 138, win 237, options [nop,nop,TS val 8045767 ecr 262592018], length 0
18:33:52.931807 IP 192.168.8.122.40698 > ec2-54-236-117-189.compute-1.amazonaws.com.https: Flags [P.], seq 518:569, ack 138, win 237, options [nop,nop,TS val 8045767 ecr 262592018], length 51
18:33:52.932208 IP 192.168.8.122.40698 > ec2-54-236-117-189.compute-1.amazonaws.com.https: Flags [P.], seq 569:1067, ack 138, win 237, options [nop,nop,TS val 8045767 ecr 262592018], length 498
18:33:52.935496 IP ec2-54-236-117-189.compute-1.amazonaws.com.https > 192.168.8.122.40700: Flags [.], ack 518, win 75, options [nop,nop,TS val 262592019 ecr 8045761], length 0
18:33:52.936252 IP ec2-54-236-117-189.compute-1.amazonaws.com.https > 192.168.8.122.40700: Flags [P.], seq 1:138, ack 518, win 75, options [nop,nop,TS val 262592019 ecr 8045761], length 137
18:33:52.936261 IP 192.168.8.122.40700 > ec2-54-236-117-189.compute-1.amazonaws.com.https: Flags [.], ack 138, win 237, options [nop,nop,TS val 8045768 ecr 262592019], length 0
18:33:52.936366 IP 192.168.8.122.40700 > ec2-54-236-117-189.compute-1.amazonaws.com.https: Flags [P.], seq 518:569, ack 138, win 237, options [nop,nop,TS val 8045768 ecr 262592019], length 51
18:33:52.936661 IP 192.168.8.122.40700 > ec2-54-236-117-189.compute-1.amazonaws.com.https: Flags [P.], seq 569:1067, ack 138, win 237, options [nop,nop,TS val 8045768 ecr 262592019], length 498
18:33:52.946601 IP qh-in-f127.1e100.net.19305 > 192.168.8.122.49334: UDP, length 104
18:33:52.952004 IP ec2-54-236-117-189.compute-1.amazonaws.com.https > 192.168.8.122.40698: Flags [P.], seq 138:169, ack 569, win 75, options [nop,nop,TS val 262592024 ecr 8045767], length 31
18:33:52.952259 IP 192.168.8.122.40698 > ec2-54-236-117-189.compute-1.amazonaws.com.https: Flags [F.], seq 1067, ack 169, win 237, options [nop,nop,TS val 8045772 ecr 262592024], length 0
18:33:52.953441 IP ec2-54-236-117-189.compute-1.amazonaws.com.https > 192.168.8.122.40698: Flags [F.], seq 169, ack 569, win 75, options [nop,nop,TS val 262592024 ecr 8045767], length 0
18:33:52.953455 IP 192.168.8.122.40698 > ec2-54-236-117-189.compute-1.amazonaws.com.https: Flags [.], ack 170, win 237, options [nop,nop,TS val 8045772 ecr 262592024], length 0
18:33:52.956171 IP ec2-54-236-117-189.compute-1.amazonaws.com.https > 192.168.8.122.40700: Flags [P.], seq 138:169, ack 569, win 75, options [nop,nop,TS val 262592025 ecr 8045768], length 31
18:33:52.956188 IP ec2-54-236-117-189.compute-1.amazonaws.com.https > 192.168.8.122.40700: Flags [F.], seq 169, ack 569, win 75, options [nop,nop,TS val 262592025 ecr 8045768], length 0
18:33:52.956369 IP 192.168.8.122.40700 > ec2-54-236-117-189.compute-1.amazonaws.com.https: Flags [F.], seq 1067, ack 170, win 237, options [nop,nop,TS val 8045773 ecr 262592025], length 0
18:33:52.972087 IP ec2-54-236-117-189.compute-1.amazonaws.com.https > 192.168.8.122.40698: Flags [.], ack 1068, win 79, options [nop,nop,TS val 262592029 ecr 8045767], length 0
18:33:52.979783 IP ec2-54-236-117-189.compute-1.amazonaws.com.https > 192.168.8.122.40700: Flags [.], ack 1068, win 79, options [nop,nop,TS val 262592031 ecr 8045768], length 0
18:33:53.235166 STP 802.1d, Config, Flags [none], bridge-id 801e.28:57:67:b1:fa:47.0c01, length 43
18:33:53.417067 IP 192.168.8.122.49334 > qh-in-f127.1e100.net.19305: UDP, length 116
18:33:53.437928 IP qg-in-f189.1e100.net.https > 192.168.8.122.52296: UDP, length 42
18:33:53.445685 IP qh-in-f127.1e100.net.19305 > 192.168.8.122.49334: UDP, length 104
18:33:53.463900 IP 192.168.8.122.52296 > qg-in-f189.1e100.net.https: UDP, length 38
18:33:53.670919 IP6 fe80::d183:3b5:b240:a754.62755 > ff02::c.1900: UDP, length 150
18:33:53.706575 IP 192.168.8.122.53432 > ams16s22-in-f227.1e100.net.https: Flags [.], ack 1737258014, win 237, options [nop,nop,TS val 8045961 ecr 3369235824], length 0
18:33:53.807334 IP ams16s22-in-f227.1e100.net.https > 192.168.8.122.53432: Flags [.], ack 1, win 350, options [nop,nop,TS val 3369280923 ecr 8012118], length 0
18:33:53.870023 IP 192.168.8.122.52078 > 23.97.220.207.https: Flags [P.], seq 2037784025:2037784110, ack 2821826218, win 245, options [nop,nop,TS val 8046001 ecr 121546881], length 85
18:33:53.877872 IP 192.168.8.122.38451 > ams16s22-in-f227.1e100.net.https: UDP, length 371
18:33:53.878506 IP 192.168.8.122.40702 > ec2-54-236-117-189.compute-1.amazonaws.com.https: Flags [S], seq 4245670525, win 29200, options [mss 1460,sackOK,TS val 8046004 ecr 0,nop,wscale 7], length 0
18:33:53.878809 IP 192.168.8.122.40704 > ec2-54-236-117-189.compute-1.amazonaws.com.https: Flags [S], seq 1414991203, win 29200, options [mss 1460,sackOK,TS val 8046004 ecr 0,nop,wscale 7], length 0
18:33:53.902902 IP ec2-54-236-117-189.compute-1.amazonaws.com.https > 192.168.8.122.40702: Flags [S.], seq 980635805, ack 4245670526, win 17898, options [mss 8961,sackOK,TS val 262592261 ecr 8046004,nop,wscale 8], length 0
18:33:53.902940 IP 192.168.8.122.40702 > ec2-54-236-117-189.compute-1.amazonaws.com.https: Flags [.], ack 1, win 229, options [nop,nop,TS val 8046010 ecr 262592261], length 0
18:33:53.903100 IP 192.168.8.122.40702 > ec2-54-236-117-189.compute-1.amazonaws.com.https: Flags [P.], seq 1:518, ack 1, win 229, options [nop,nop,TS val 8046010 ecr 262592261], length 517
18:33:53.904599 IP ec2-54-236-117-189.compute-1.amazonaws.com.https > 192.168.8.122.40704: Flags [S.], seq 2022824700, ack 1414991204, win 17898, options [mss 8961,sackOK,TS val 262592261 ecr 8046004,nop,wscale 8], length 0
18:33:53.904621 IP 192.168.8.122.40704 > ec2-54-236-117-189.compute-1.amazonaws.com.https: Flags [.], ack 1, win 229, options [nop,nop,TS val 8046010 ecr 262592261], length 0
18:33:53.904750 IP 192.168.8.122.40704 > ec2-54-236-117-189.compute-1.amazonaws.com.https: Flags [P.], seq 1:518, ack 1, win 229, options [nop,nop,TS val 8046010 ecr 262592261], length 517
18:33:53.917405 IP 192.168.8.122.49334 > qh-in-f127.1e100.net.19305: UDP, length 116
18:33:53.928395 IP ec2-54-236-117-189.compute-1.amazonaws.com.https > 192.168.8.122.40702: Flags [.], ack 518, win 75, options [nop,nop,TS val 262592268 ecr 8046010], length 0
18:33:53.928406 IP ec2-54-236-117-189.compute-1.amazonaws.com.https > 192.168.8.122.40702: Flags [P.], seq 1:138, ack 518, win 75, options [nop,nop,TS val 262592268 ecr 8046010], length 137
18:33:53.928414 IP 192.168.8.122.40702 > ec2-54-236-117-189.compute-1.amazonaws.com.https: Flags [.], ack 138, win 237, options [nop,nop,TS val 8046016 ecr 262592268], length 0
18:33:53.928520 IP 192.168.8.122.40702 > ec2-54-236-117-189.compute-1.amazonaws.com.https: Flags [P.], seq 518:569, ack 138, win 237, options [nop,nop,TS val 8046016 ecr 262592268], length 51
18:33:53.928937 IP 192.168.8.122.40702 > ec2-54-236-117-189.compute-1.amazonaws.com.https: Flags [P.], seq 569:1067, ack 138, win 237, options [nop,nop,TS val 8046016 ecr 262592268], length 498
18:33:53.929188 IP ec2-54-236-117-189.compute-1.amazonaws.com.https > 192.168.8.122.40704: Flags [.], ack 518, win 75, options [nop,nop,TS val 262592268 ecr 8046010], length 0
18:33:53.929195 IP ec2-54-236-117-189.compute-1.amazonaws.com.https > 192.168.8.122.40704: Flags [P.], seq 1:138, ack 518, win 75, options [nop,nop,TS val 262592268 ecr 8046010], length 137
18:33:53.929204 IP 192.168.8.122.40704 > ec2-54-236-117-189.compute-1.amazonaws.com.https: Flags [.], ack 138, win 237, options [nop,nop,TS val 8046016 ecr 262592268], length 0
18:33:53.929299 IP 192.168.8.122.40704 > ec2-54-236-117-189.compute-1.amazonaws.com.https: Flags [P.], seq 518:569, ack 138, win 237, options [nop,nop,TS val 8046016 ecr 262592268], length 51
18:33:53.929622 IP 192.168.8.122.40704 > ec2-54-236-117-189.compute-1.amazonaws.com.https: Flags [P.], seq 569:1067, ack 138, win 237, options [nop,nop,TS val 8046016 ecr 262592268], length 498
18:33:53.946050 IP qh-in-f127.1e100.net.19305 > 192.168.8.122.49334: UDP, length 104
18:33:53.949233 IP ec2-54-236-117-189.compute-1.amazonaws.com.https > 192.168.8.122.40702: Flags [P.], seq 138:169, ack 569, win 75, options [nop,nop,TS val 262592273 ecr 8046016], length 31
18:33:53.949466 IP 192.168.8.122.40702 > ec2-54-236-117-189.compute-1.amazonaws.com.https: Flags [F.], seq 1067, ack 169, win 237, options [nop,nop,TS val 8046021 ecr 262592273], length 0
18:33:53.950669 IP ec2-54-236-117-189.compute-1.amazonaws.com.https > 192.168.8.122.40702: Flags [F.], seq 169, ack 569, win 75, options [nop,nop,TS val 262592273 ecr 8046016], length 0
18:33:53.950680 IP 192.168.8.122.40702 > ec2-54-236-117-189.compute-1.amazonaws.com.https: Flags [.], ack 170, win 237, options [nop,nop,TS val 8046022 ecr 262592273], length 0
18:33:53.954635 IP ec2-54-236-117-189.compute-1.amazonaws.com.https > 192.168.8.122.40704: Flags [.], ack 1067, win 79, options [nop,nop,TS val 262592274 ecr 8046016], length 0
18:33:53.954649 IP ec2-54-236-117-189.compute-1.amazonaws.com.https > 192.168.8.122.40704: Flags [P.], seq 138:169, ack 1067, win 79, options [nop,nop,TS val 262592275 ecr 8046016], length 31
18:33:53.954821 IP 192.168.8.122.40704 > ec2-54-236-117-189.compute-1.amazonaws.com.https: Flags [F.], seq 1067, ack 169, win 237, options [nop,nop,TS val 8046023 ecr 262592275], length 0
18:33:53.956031 IP ec2-54-236-117-189.compute-1.amazonaws.com.https > 192.168.8.122.40704: Flags [F.], seq 169, ack 1067, win 79, options [nop,nop,TS val 262592275 ecr 8046016], length 0
18:33:53.956042 IP 192.168.8.122.40704 > ec2-54-236-117-189.compute-1.amazonaws.com.https: Flags [.], ack 170, win 237, options [nop,nop,TS val 8046023 ecr 262592275], length 0
18:33:53.966247 IP 23.97.220.207.https > 192.168.8.122.52078: Flags [P.], seq 1:70, ack 85, win 511, options [nop,nop,TS val 121547866 ecr 8046001], length 69
18:33:53.966258 IP 192.168.8.122.52078 > 23.97.220.207.https: Flags [.], ack 70, win 245, options [nop,nop,TS val 8046025 ecr 121547866], length 0
18:33:53.969793 IP ec2-54-236-117-189.compute-1.amazonaws.com.https > 192.168.8.122.40702: Flags [.], ack 1068, win 79, options [nop,nop,TS val 262592278 ecr 8046016], length 0
18:33:53.975251 IP ec2-54-236-117-189.compute-1.amazonaws.com.https > 192.168.8.122.40704: Flags [.], ack 1068, win 79, options [nop,nop,TS val 262592280 ecr 8046023], length 0
18:33:53.983017 IP ams16s22-in-f227.1e100.net.https > 192.168.8.122.38451: UDP, length 84
18:33:54.008974 IP 192.168.8.122.38451 > ams16s22-in-f227.1e100.net.https: UDP, length 37
18:33:54.382862 IP 192.168.8.122.61797 > vdnssec1.srv.prnynj.cv.net.domain: 7505+ PTR? 189.29.125.74.in-addr.arpa. (44)
18:33:54.397703 IP vdnssec1.srv.prnynj.cv.net.domain > 192.168.8.122.61797: 7505 1/0/0 PTR qg-in-f189.1e100.net. (78)
18:33:54.398004 IP 192.168.8.122.23259 > vdnssec1.srv.prnynj.cv.net.domain: 34771+ PTR? c.0.0.0.0.0.0.0.0.0.0.0.0.0.0.0.0.0.0.0.0.0.0.0.0.0.0.0.2.0.f.f.ip6.arpa. (90)
18:33:54.417735 IP 192.168.8.122.49334 > qh-in-f127.1e100.net.19305: UDP, length 116
18:33:54.421334 IP vdnssec1.srv.prnynj.cv.net.domain > 192.168.8.122.23259: 34771 NXDomain 0/1/0 (160)
18:33:54.421644 IP 192.168.8.122.4093 > vdnssec1.srv.prnynj.cv.net.domain: 37563+ PTR? 4.5.7.a.0.4.2.b.5.b.3.0.3.8.1.d.0.0.0.0.0.0.0.0.0.0.0.0.0.8.e.f.ip6.arpa. (90)
18:33:54.444555 IP vdnssec1.srv.prnynj.cv.net.domain > 192.168.8.122.4093: 37563 NXDomain 0/1/0 (160)
18:33:54.444822 IP 192.168.8.122.2075 > vdnssec1.srv.prnynj.cv.net.domain: 38995+ PTR? 227.212.58.216.in-addr.arpa. (45)
18:33:54.447196 IP qh-in-f127.1e100.net.19305 > 192.168.8.122.49334: UDP, length 104
18:33:54.453906 IP 192.168.8.122.mdns > 224.0.0.251.mdns: 0 [2q] A (QM)? dp-450500VK.local. SRV (QM)? dp-450500VK._sftp-ssh._tcp.local. (68)
18:33:54.482306 IP vdnssec1.srv.prnynj.cv.net.domain > 192.168.8.122.2075: 38995 2/0/0 PTR ams16s22-in-f227.1e100.net., PTR ams16s22-in-f3.1e100.net. (114)
18:33:54.482629 IP 192.168.8.122.40120 > vdnssec1.srv.prnynj.cv.net.domain: 30547+ PTR? 207.220.97.23.in-addr.arpa. (44)
18:33:54.539185 IP vdnssec1.srv.prnynj.cv.net.domain > 192.168.8.122.40120: 30547 NXDomain 0/0/0 (44)
18:33:54.744065 IP 192.168.8.103.mdns > 224.0.0.251.mdns: 0*- [0q] 2/0/0 (Cache flush) SRV dp-450500VK.local.:22 0 0, (Cache flush) A 192.168.8.103 (92)
18:33:54.872464 IP 192.168.8.122.40706 > ec2-54-236-117-189.compute-1.amazonaws.com.https: Flags [S], seq 574213772, win 29200, options [mss 1460,sackOK,TS val 8046252 ecr 0,nop,wscale 7], length 0
18:33:54.872826 IP 192.168.8.122.40708 > ec2-54-236-117-189.compute-1.amazonaws.com.https: Flags [S], seq 2612218146, win 29200, options [mss 1460,sackOK,TS val 8046252 ecr 0,nop,wscale 7], length 0
18:33:54.894793 IP ec2-54-236-117-189.compute-1.amazonaws.com.https > 192.168.8.122.40706: Flags [S.], seq 2173426188, ack 574213773, win 17898, options [mss 8961,sackOK,TS val 262592509 ecr 8046252,nop,wscale 8], length 0
18:33:54.894826 IP 192.168.8.122.40706 > ec2-54-236-117-189.compute-1.amazonaws.com.https: Flags [.], ack 1, win 229, options [nop,nop,TS val 8046258 ecr 262592509], length 0
18:33:54.894980 IP 192.168.8.122.40706 > ec2-54-236-117-189.compute-1.amazonaws.com.https: Flags [P.], seq 1:518, ack 1, win 229, options [nop,nop,TS val 8046258 ecr 262592509], length 517
18:33:54.898635 IP ec2-54-236-117-189.compute-1.amazonaws.com.https > 192.168.8.122.40708: Flags [S.], seq 1031804223, ack 2612218147, win 17898, options [mss 8961,sackOK,TS val 262592510 ecr 8046252,nop,wscale 8], length 0
18:33:54.898651 IP 192.168.8.122.40708 > ec2-54-236-117-189.compute-1.amazonaws.com.https: Flags [.], ack 1, win 229, options [nop,nop,TS val 8046259 ecr 262592510], length 0
18:33:54.898758 IP 192.168.8.122.40708 > ec2-54-236-117-189.compute-1.amazonaws.com.https: Flags [P.], seq 1:518, ack 1, win 229, options [nop,nop,TS val 8046259 ecr 262592510], length 517
18:33:54.918049 IP 192.168.8.122.49334 > qh-in-f127.1e100.net.19305: UDP, length 116
18:33:54.921312 IP ec2-54-236-117-189.compute-1.amazonaws.com.https > 192.168.8.122.40706: Flags [.], ack 518, win 75, options [nop,nop,TS val 262592516 ecr 8046258], length 0
18:33:54.921320 IP ec2-54-236-117-189.compute-1.amazonaws.com.https > 192.168.8.122.40706: Flags [P.], seq 1:138, ack 518, win 75, options [nop,nop,TS val 262592516 ecr 8046258], length 137
18:33:54.921326 IP 192.168.8.122.40706 > ec2-54-236-117-189.compute-1.amazonaws.com.https: Flags [.], ack 138, win 237, options [nop,nop,TS val 8046264 ecr 262592516], length 0
18:33:54.921423 IP 192.168.8.122.40706 > ec2-54-236-117-189.compute-1.amazonaws.com.https: Flags [P.], seq 518:569, ack 138, win 237, options [nop,nop,TS val 8046264 ecr 262592516], length 51
18:33:54.921795 IP 192.168.8.122.40706 > ec2-54-236-117-189.compute-1.amazonaws.com.https: Flags [P.], seq 569:1067, ack 138, win 237, options [nop,nop,TS val 8046264 ecr 262592516], length 498
18:33:54.925229 IP ec2-54-236-117-189.compute-1.amazonaws.com.https > 192.168.8.122.40708: Flags [.], ack 518, win 75, options [nop,nop,TS val 262592517 ecr 8046259], length 0
18:33:54.925957 IP ec2-54-236-117-189.compute-1.amazonaws.com.https > 192.168.8.122.40708: Flags [P.], seq 1:138, ack 518, win 75, options [nop,nop,TS val 262592517 ecr 8046259], length 137
18:33:54.925964 IP 192.168.8.122.40708 > ec2-54-236-117-189.compute-1.amazonaws.com.https: Flags [.], ack 138, win 237, options [nop,nop,TS val 8046265 ecr 262592517], length 0
18:33:54.926038 IP 192.168.8.122.40708 > ec2-54-236-117-189.compute-1.amazonaws.com.https: Flags [P.], seq 518:569, ack 138, win 237, options [nop,nop,TS val 8046265 ecr 262592517], length 51
18:33:54.926289 IP 192.168.8.122.40708 > ec2-54-236-117-189.compute-1.amazonaws.com.https: Flags [P.], seq 569:1067, ack 138, win 237, options [nop,nop,TS val 8046265 ecr 262592517], length 498
18:33:54.943663 IP ec2-54-236-117-189.compute-1.amazonaws.com.https > 192.168.8.122.40706: Flags [.], ack 1067, win 79, options [nop,nop,TS val 262592522 ecr 8046264], length 0
18:33:54.943677 IP ec2-54-236-117-189.compute-1.amazonaws.com.https > 192.168.8.122.40706: Flags [P.], seq 138:169, ack 1067, win 79, options [nop,nop,TS val 262592522 ecr 8046264], length 31
18:33:54.943907 IP 192.168.8.122.40706 > ec2-54-236-117-189.compute-1.amazonaws.com.https: Flags [F.], seq 1067, ack 169, win 237, options [nop,nop,TS val 8046270 ecr 262592522], length 0
18:33:54.945117 IP ec2-54-236-117-189.compute-1.amazonaws.com.https > 192.168.8.122.40706: Flags [F.], seq 169, ack 1067, win 79, options [nop,nop,TS val 262592522 ecr 8046264], length 0
18:33:54.945128 IP 192.168.8.122.40706 > ec2-54-236-117-189.compute-1.amazonaws.com.https: Flags [.], ack 170, win 237, options [nop,nop,TS val 8046270 ecr 262592522], length 0
18:33:54.946570 IP qh-in-f127.1e100.net.19305 > 192.168.8.122.49334: UDP, length 104
18:33:54.947932 IP ec2-54-236-117-189.compute-1.amazonaws.com.https > 192.168.8.122.40708: Flags [.], ack 1067, win 79, options [nop,nop,TS val 262592523 ecr 8046265], length 0
18:33:54.947943 IP ec2-54-236-117-189.compute-1.amazonaws.com.https > 192.168.8.122.40708: Flags [P.], seq 138:169, ack 1067, win 79, options [nop,nop,TS val 262592523 ecr 8046265], length 31
18:33:54.947952 IP ec2-54-236-117-189.compute-1.amazonaws.com.https > 192.168.8.122.40708: Flags [F.], seq 169, ack 1067, win 79, options [nop,nop,TS val 262592523 ecr 8046265], length 0
18:33:54.948121 IP 192.168.8.122.40708 > ec2-54-236-117-189.compute-1.amazonaws.com.https: Flags [F.], seq 1067, ack 170, win 237, options [nop,nop,TS val 8046271 ecr 262592523], length 0
18:33:54.965614 IP ec2-54-236-117-189.compute-1.amazonaws.com.https > 192.168.8.122.40706: Flags [.], ack 1068, win 79, options [nop,nop,TS val 262592527 ecr 8046270], length 0
18:33:54.968480 IP ec2-54-236-117-189.compute-1.amazonaws.com.https > 192.168.8.122.40708: Flags [.], ack 1068, win 79, options [nop,nop,TS val 262592528 ecr 8046271], length 0
18:33:55.090629 IP 192.168.8.122.60422 > 155.56.220.133.https: Flags [.], ack 3502633144, win 64975, options [nop,nop,TS val 8046307 ecr 322942106], length 0
18:33:55.108284 IP6 fe80::d183:3b5:b240:a754.dhcpv6-client > ff02::1:2.dhcpv6-server: dhcp6 solicit
18:33:55.194274 IP 155.56.220.133.https > 192.168.8.122.60422: Flags [.], ack 1, win 65535, options [nop,nop,TS val 322987205 ecr 8001201], length 0
18:33:55.235196 STP 802.1d, Config, Flags [none], bridge-id 801e.28:57:67:b1:fa:47.0c01, length 43
18:33:55.382916 IP 192.168.8.122.52715 > vdnssec1.srv.prnynj.cv.net.domain: 9158+ PTR? 251.0.0.224.in-addr.arpa. (42)
18:33:55.397514 IP vdnssec1.srv.prnynj.cv.net.domain > 192.168.8.122.52715: 9158 NXDomain 0/1/0 (99)
18:33:55.397808 IP 192.168.8.122.50362 > vdnssec1.srv.prnynj.cv.net.domain: 20593+ PTR? 103.8.168.192.in-addr.arpa. (44)
18:33:55.411935 IP vdnssec1.srv.prnynj.cv.net.domain > 192.168.8.122.50362: 20593 NXDomain 0/0/0 (44)
18:33:55.412357 IP 192.168.8.122.25043 > vdnssec1.srv.prnynj.cv.net.domain: 47752+ PTR? 133.220.56.155.in-addr.arpa. (45)
18:33:55.418406 IP 192.168.8.122.49334 > qh-in-f127.1e100.net.19305: UDP, length 116
18:33:55.448579 IP qh-in-f127.1e100.net.19305 > 192.168.8.122.49334: UDP, length 104
18:33:55.562778 IP vdnssec1.srv.prnynj.cv.net.domain > 192.168.8.122.25043: 47752 NXDomain 0/1/0 (97)
18:33:55.563206 IP 192.168.8.122.52824 > vdnssec1.srv.prnynj.cv.net.domain: 18462+ PTR? 2.0.0.0.1.0.0.0.0.0.0.0.0.0.0.0.0.0.0.0.0.0.0.0.0.0.0.0.2.0.f.f.ip6.arpa. (90)
18:33:55.578117 IP vdnssec1.srv.prnynj.cv.net.domain > 192.168.8.122.52824: 18462 NXDomain 0/1/0 (160)
18:33:55.879886 IP 192.168.8.122.38451 > ams16s22-in-f227.1e100.net.https: UDP, length 398
18:33:55.880230 IP 192.168.8.122.40710 > ec2-54-236-117-189.compute-1.amazonaws.com.https: Flags [S], seq 2649208164, win 29200, options [mss 1460,sackOK,TS val 8046504 ecr 0,nop,wscale 7], length 0
18:33:55.880381 IP 192.168.8.122.40712 > ec2-54-236-117-189.compute-1.amazonaws.com.https: Flags [S], seq 3464082415, win 29200, options [mss 1460,sackOK,TS val 8046504 ecr 0,nop,wscale 7], length 0
18:33:55.911686 IP ec2-54-236-117-189.compute-1.amazonaws.com.https > 192.168.8.122.40710: Flags [S.], seq 2565769694, ack 2649208165, win 17898, options [mss 8961,sackOK,TS val 262592764 ecr 8046504,nop,wscale 8], length 0
18:33:55.911721 IP 192.168.8.122.40710 > ec2-54-236-117-189.compute-1.amazonaws.com.https: Flags [.], ack 1, win 229, options [nop,nop,TS val 8046512 ecr 262592764], length 0
18:33:55.911728 IP ec2-54-236-117-189.compute-1.amazonaws.com.https > 192.168.8.122.40712: Flags [S.], seq 3487232420, ack 3464082416, win 17898, options [mss 8961,sackOK,TS val 262592764 ecr 8046504,nop,wscale 8], length 0
18:33:55.911738 IP 192.168.8.122.40712 > ec2-54-236-117-189.compute-1.amazonaws.com.https: Flags [.], ack 1, win 229, options [nop,nop,TS val 8046512 ecr 262592764], length 0
18:33:55.911944 IP 192.168.8.122.40710 > ec2-54-236-117-189.compute-1.amazonaws.com.https: Flags [P.], seq 1:518, ack 1, win 229, options [nop,nop,TS val 8046512 ecr 262592764], length 517
18:33:55.912008 IP 192.168.8.122.40712 > ec2-54-236-117-189.compute-1.amazonaws.com.https: Flags [P.], seq 1:518, ack 1, win 229, options [nop,nop,TS val 8046512 ecr 262592764], length 517
18:33:55.918748 IP 192.168.8.122.49334 > qh-in-f127.1e100.net.19305: UDP, length 116
18:33:55.936949 IP ec2-54-236-117-189.compute-1.amazonaws.com.https > 192.168.8.122.40710: Flags [.], ack 518, win 75, options [nop,nop,TS val 262592770 ecr 8046512], length 0
18:33:55.937718 IP ec2-54-236-117-189.compute-1.amazonaws.com.https > 192.168.8.122.40710: Flags [P.], seq 1:138, ack 518, win 75, options [nop,nop,TS val 262592770 ecr 8046512], length 137
18:33:55.937730 IP 192.168.8.122.40710 > ec2-54-236-117-189.compute-1.amazonaws.com.https: Flags [.], ack 138, win 237, options [nop,nop,TS val 8046518 ecr 262592770], length 0
18:33:55.937739 IP ec2-54-236-117-189.compute-1.amazonaws.com.https > 192.168.8.122.40712: Flags [.], ack 518, win 75, options [nop,nop,TS val 262592770 ecr 8046512], length 0
18:33:55.937747 IP ec2-54-236-117-189.compute-1.amazonaws.com.https > 192.168.8.122.40712: Flags [P.], seq 1:138, ack 518, win 75, options [nop,nop,TS val 262592770 ecr 8046512], length 137
18:33:55.937752 IP 192.168.8.122.40712 > ec2-54-236-117-189.compute-1.amazonaws.com.https: Flags [.], ack 138, win 237, options [nop,nop,TS val 8046518 ecr 262592770], length 0
18:33:55.937865 IP 192.168.8.122.40710 > ec2-54-236-117-189.compute-1.amazonaws.com.https: Flags [P.], seq 518:569, ack 138, win 237, options [nop,nop,TS val 8046518 ecr 262592770], length 51
18:33:55.938127 IP 192.168.8.122.40712 > ec2-54-236-117-189.compute-1.amazonaws.com.https: Flags [P.], seq 518:569, ack 138, win 237, options [nop,nop,TS val 8046518 ecr 262592770], length 51
18:33:55.938310 IP 192.168.8.122.40710 > ec2-54-236-117-189.compute-1.amazonaws.com.https: Flags [P.], seq 569:1067, ack 138, win 237, options [nop,nop,TS val 8046518 ecr 262592770], length 498
18:33:55.938381 IP 192.168.8.122.40712 > ec2-54-236-117-189.compute-1.amazonaws.com.https: Flags [P.], seq 569:1067, ack 138, win 237, options [nop,nop,TS val 8046518 ecr 262592770], length 498
18:33:55.947084 IP qh-in-f127.1e100.net.19305 > 192.168.8.122.49334: UDP, length 104
